title,creator,extent,issued,material_type
障害児教育福祉史の偉人伝 : 愛知の障害児者支援への尽力,"小川, 英彦, 1957-",['168 p ; 21 cm'],2021,['図書']
한국장애인사 : 역사 속의 장애 인물,"방, 귀희",['320 p ; 26 cm'],2023,['図書']
むつぼしのひかり,点字雑誌むつぼしのひかりデータ化研究プロジェクト,['冊 ; 30cm'],2016,['雑誌']
視覚障害者柔道の歴史 : 人物史を中心に,"伊藤, 友治, 1950-",['207 p ; 26 cm'],2022,['図書']
講話 より巨いなる山の動く日 : 障害者問題の歴史と展望.,"清水, 寛, 1936-",['204 p ; 21 cm'],2023,['図書']
講話 より巨いなる山の動く日 : 障害者問題の歴史と展望.,"清水, 寛, 1936-",['p 443-606 ; 21 cm'],2023,['図書']
講話 より巨いなる山の動く日 : 障害者問題の歴史と展望.,"清水, 寛, 1936-",['p 205-442 ; 21 cm'],2023,['図書']
中東のなかの「障害と開発」,"森, 壮也, 1962-",['199 p ; 21 cm'],2023,"['図書', '政府刊行物', '官公庁刊行物']"
楽善会訓盲唖院記録 : 翻刻,筑波大学附属視覚特別支援学校,"['7, 199, 54 p ; 26 cm']",2023,['図書']
障害ピアサポート : 多様な障害領域の歴史と今後の展望,"岩崎, 香",['243p ; 21cm'],2019,['図書']
障害があり女性であること : 生活史からみる生きづらさ,"土屋, 葉, 1973-",['326p ; 20cm'],2023,['図書']
少年行刑の歴史からみる知的障害者福祉の萌芽,"末松, 惠, 1960-","['12, 370 p ; 22 cm']",2022,['図書']
ひきこもりと発達障害のアポリア : 歴史的視座から辿る8050問題,"鈴木, 信子, 1971-",['266 p ; 19 cm'],2022,['図書']
病者障害者の戦後 : 生政治史点描,"立岩, 真也, 1960-","['476,43p ; 19cm']",2018,['図書']
障害児教育福祉史の人物 : 保育・教育・福祉・医療で支える,"小川, 英彦, 1957-",['171p ; 21cm'],2020,['図書']
戦後教育史 : 貧困・校内暴力・いじめから、不登校・発達障害問題まで,"小国, 喜弘, 1966-",['320p ; 18cm'],2023,['図書']
「障害者運動」の歴史と現在 : 豊橋市における障害のある人の「声」から考える,愛知大学文学部,['145p ; 30cm'],2017,['図書']
障害史研究,障害史研究会,['冊 ; 30cm'],2020,"['雑誌', '政府刊行物', '官公庁刊行物']"
障害のある人と優生思想,日本障害者協議会,['123p ; 21cm'],2019,['図書']
戦後日本の子どもから障害児を分けない教育の史的研究,"久米, 祐子",,2021-01-31,['博士論文']
東京都の3つの旧身体障害者療護施設における入居者自治会による施設改革運動に関する研究 : 重度身体障害者が「生活の自由と自己決定」を求める運動の歴史的研究,,,2021,
障害児教育史研究 : 史料と論究,障害児教育史研究会,['冊 ; 21cm'],2018,['雑誌']
近代日本聴覚障害者生活史・断章,"松延, 秀一, 1955-",['241p ; 21cm'],2019,['図書']
障害児教育福祉史の資料集成 : 戦前の劣等児・精神薄弱児教育,"小川, 英彦, 1957-","['18, 197p ; 21cm']",2020,['図書']
史群アル仙のメンタルチップス : 不安障害とADHDの歩き方,"史群, アル仙, 1990-",['141p ; 21cm'],2018,['図書']
한국장애인사 : 역사 속의 장애 인물,"정, 창권",['320p ; 26cm + 51p'],2014,['図書']
障害児教育の方法論を問う : 人間一般から説く科学的障害児教育,"志垣, 司",['276p ; 19cm'],2017,['図書']
歴史のなかの障害者,"山下, 麻衣",['342p ; 20cm'],2014,['図書']
知的障害者と「わかりやすい選挙」 : 新しい権利保障としての「狛江モデル」構築の軌跡,"堀川, 諭, 1977-",['305p ; 21cm'],2024,['図書']
異形の人たち : 歴史の中の障害福祉,"楠, 峰光, 1943-",['191p ; 20cm'],2015,['図書']
障害学のアイデンティティ : 日本における障害者運動の歴史から,"堀, 智久, 1979-",['220p ; 22cm'],2014,['図書']
障害児教育のアメリカ史と日米関係史 : 後進国から世界最先端の特殊教育への飛翔と失速,"中村, 満紀男, 1945-",['1029p ; 22cm'],2021,['図書']
発達障害のある子を担任!どんな準備をするか : 『向山洋一は障害児教育にどう取り組んだか』に学ぶ,"向山, 洋一, 1943-",['183p ; 21cm'],2018,['図書']
精神障害者支援の思想と戦略 : QOLからHOLへ,"田中, 英樹, 1948-",['277p ; 22cm'],2018,['図書']
伝導失語 : 復唱障害、STM障害、音韻性錯語,日本高次脳機能障害学会,['278p ; 21cm'],2012,['図書']
障害児教育福祉史の記録 : アーカイブスの活用へ,"小川, 英彦, 1957-",['197p ; 21cm'],2016,['図書']
子どもから障害児を「分けない教育」の戦後史 : インクルーシブ教育とは,"久米, 祐子, 1959-","['227,5p ; 26cm']",2022,['図書']
重症心身障害児〈者〉医療福祉の誕生 : その歴史と論点,"岡田, 喜篤",['230p ; 22cm'],2016,['図書']
「知的障害者」に向けた前期中等教育において職業生活準備教育が重視される背景 -歴史的観点からの考察-,"西脇, 啓太",,2022,['博士論文']
史群アル仙のメンタルチップス : 不安障害とADHDの歩き方,"史群, アル仙, 1990-",['143p ; 21cm'],2017,['図書']
障害児教育福祉の通史 : 名古屋の学校・施設の歩み,"小川, 英彦, 1957-","['11, 141p ; 21cm']",2019,['図書']
障害教師論 : インクルーシブ教育と教師支援の新たな射程,"中村, 雅也","['212,13p ; 22cm']",2020,['図書']
障害児教育福祉の地域史 : 名古屋・愛知を対象に,"小川, 英彦, 1957-","['12, 142p ; 21cm']",2018,['図書']
通史日本の障害者 : 明治・大正・昭和,"山田, 明, 1947-",['243p ; 22cm'],2013,['図書']
総力戦体制と障害児保育論の形成 : 日本障害児保育史研究序説,"河合, 隆平, 1978-",['313p ; 22cm'],2012,['図書']
視覚障害当事者の運動の歴史 : 日本盲人会連合70年史,日本盲人会連合,['266p ; 30cm + CD-ROM 1枚 (12cm)'],2018,['図書']
輝くいのちの伴走者 : 障害福祉の先達との対話 : 浅野史郎対話集,"浅野, 史郎, 1948-",['208p ; 19cm'],2016,['図書']
イタリアのフルインクルーシブ教育 : 障害児の学校を無くした教育の歴史・課題・理念,"Mura, Antonello",['303p ; 19cm'],2022,['図書']
近代日本における災害救済と障害・疾病等を有する子どもの特別教育史研究 : 濃尾震災（1891年）を中心として,,,2020-03-17,
障害者教育史 社会問題としてたどる外国と日本の通史,"津曲, 裕次, 1936-",['CD-ROM 1枚'],2019,"['電子資料', 'DVD・CD']"
発達障害の臨床,,['ビデオディスク 1枚 (43分) : DVD'],2011,"['映像資料', 'DVD']"
聴覚障害教育の歴史と展望,ろう教育科学会,['503p ; 22cm'],2012,['図書']
全国情緒障害教育研究会からみた自閉症教育のあゆみと今後の展望,全国情緒障害教育研究会,['175p ; 26cm'],2017,['図書']
現場から考える精神療法 : うつ、統合失調症、そして発達障害,"村上, 伸治",['217p ; 21cm'],2017,['図書']
少年行刑の歴史からみる知的障害者福祉の萌芽－浦和監獄川越分監における処遇に着目して,"末松, 惠",,2019-03-20,['博士論文']
戦後における重度重複障害児教育実践の創成に関する歴史研究とアーカイブ化,"越野, 和之, 1964-",['260p'],"2016, 2019",['図書']
障害学国際セミナー,"川端, 美季, 1980-",['340p ; 21cm'],2013,['図書']
精神障害者の地域生活支援の枠組み,,['ビデオディスク 1枚 (13分) : DVD'],2009,"['映像資料', 'DVD']"
重症心身障害児者施設の歴史的背景と看護のありよう : くらしの中で福祉職と協働する看護の再定義,"窪田, 好恵",,2017-09-25,['博士論文']
"障害者運動における専門家と家族の歴史的考察 : 障害児者がいることと,そのありのままの肯定へ","堀, 智久",['2冊 (副論文・参考論文とも)'],2011,['博士論文']
障害児教育福祉の歴史 : 先駆的実践者の検証,"小川, 英彦, 1957-",['129p ; 21cm'],2014,['図書']
역사 속 장애인은 어떻게 살았을까 : 사료와 함께 읽는 장애인사,"정, 창권 (鄭昌權)",['565p ; 23cm'],2011,['図書']
DVDで学ぶ精神科ソーシャルワーク入門,,['ビデオディスク 1枚 (30分) : DVD'],2016,"['映像資料', 'DVD']"
特別支援学校中学部視覚障害者用社会 (歴史) 文部科学省著作教科書,,['9冊 ; 27cm'],2016,['図書']
往復書簡 : 日本の障害者福祉の礎となったヘレン・ケラー女史と岩橋武夫,"Keller, Helen, 1880-1968",['230p ; 30cm'],2012,['図書']
往復書簡 日本の障害者福祉の礎となったヘレン・ケラー女史と岩橋武夫,"Keller, Helen, 1880-1968",['4冊 ; 27cm'],2012,['図書']
障害児教育体制に関する社会学的探究 : 盲学校教育をめぐる歴史過程と実践の論理,,,2014,
ドイツ知的障害‘親の会’レーベンスヒルフェの成立史研究,"松本, 瑞穂",['1冊'],2011,['博士論文']
自閉症教育と知的障害教育 : 授業とカリキュラム開発の歴史と展望,"太田, 正巳, 1953-",['139p ; 21cm'],2012,['図書']
障害年金というヒント : 誰も知らない最強の社会保障 : 史上最強の社労士チームが徹底ガイド!,"中井, 宏, 1964-",['187p ; 19cm'],2014,['図書']
20世紀ロシアの挑戦盲ろう児教育の歴史 : 事例研究にみる障害児教育の成功と発展,"Basilova, Tatiana Aleksandrovna",['285p ; 20cm'],2017,['図書']
障害児教育・福祉年史集成,,"['186, 215p ; 27cm']",2005,['図書']
障害児教育・福祉年史集成,,"['348, 148p ; 27cm']",2005,['図書']
障害児教育・福祉年史集成,,['287p ; 27cm'],2005,['図書']
障害児教育・福祉年史集成,,"['98, 217, 66p ; 27cm']",2005,['図書']
障害児教育・福祉年史集成,,"['174, 185p ; 27cm']",2005,['図書']
障害児教育・福祉年史集成,,"['162, 254p ; 27cm']",2005,['図書']
障害児教育・福祉年史集成,,"['73, 173, 308p ; 27cm']",2005,['図書']
論集現代日本の教育史,"辻本, 雅史, 1949-",['618p ; 22cm'],2013,['図書']
障害者スポーツの総合的研究 : 歴史、現状分析と普及・振興の条件,"藤田, 紀昭, 1962-",['1冊'],2012,['博士論文']
関西障害者運動の現代史 : 大阪青い芝の会を中心に,"定藤, 邦子",['337p ; 20cm'],2011,['図書']
障害児教育・福祉年史集成,,"['211, 12, 240p ; 27cm']",2004,['図書']
強迫性障害の研究,OCD研究会,['182p ; 21cm'],2004,['図書']
障害児教育・福祉年史集成,,['432p ; 27cm'],2004,['図書']
障害児教育・福祉年史集成,,['1冊 ; 27cm'],2004,['図書']
障害児教育・福祉年史集成,,"['73, 199p ; 27cm']",2004,['図書']
注意欠陥/多動性障害の研究史 : 時代の鏡に照らして見たクラマーとポルノウ,"Rothenberger, Aribert",['158p ; 24cm'],2015,['図書']
障害児教育・福祉年史集成,,"['54, 140p ; 27cm']",2004,['図書']
障害児教育・福祉年史集成,,"['277, 155, 213p ; 27cm']",2004,['図書']
障害児教育・福祉年史集成,,['599p ; 27cm'],2004,['図書']
自己愛性人格/解離性障害/躁うつ病の拡散 : 精神医学における症例記述の復権のために,"鈴木, 茂, 1948-2013",['307p ; 22cm'],2015,['図書']
障害児教育・福祉年史集成 : 第1・2期解説・付録,"津曲, 裕次, 1936-",['98p ; 26cm'],2005,['図書']
<ADHD(注意欠陥/多動性障害)関連>論文集,,['285p ; 26cm'],2007,['図書']
ことばに障害がある人の歴史をさぐる,"山本, 正志",['129p ; 19cm'],2005,['図書']
障害児の教育権保障と教育実践の課題 : 養護学校義務制実施に向けた取り組みに学びながら,"二通, 諭, 1951-",['227p ; 26cm'],2014,['図書']
検証日本の精神科社会的入院と家族 : 精神科長期入院者とその家族について歴史的考察とその実態-精神障害者福祉への政策提言,"滝沢, 武久, 1942-",['292p ; 21cm'],2014,['図書']
視覚障害者の教育・職業・福祉 : その歴史と現状,"谷合, 侑, 1932-",['206p ; 26cm'],2005,['図書']
視覚障害教育の歴史・現状・課題 : 職業教育・進路保障と地域支援の充実を願って,"久松, 寅幸, 1951-",['304p ; 26cm'],2012,['図書']
視覚障害教育の歴史・現状・課題 職業教育・進路保障と地域支援の充実を願って,"久松, 寅幸, 1951-",['5冊 ; 27cm'],2012,['図書']
障害者の国際人権保障 : その歴史と課題,"川島, 聡",['1冊'],2005,['博士論文']
社会は障害のある人たちに何を期待しているか : 生涯学習実践から知的能力をめぐる問題を考える,"西村, 愛",['173p ; 19cm'],2014,['図書']
挑戦こそわが生命 : 視覚障害者たちの挑戦史 : 歴史エッセイ,"谷合, 侑, 1932-",['293p ; 21cm'],2006,['図書']
難聴 : 知られざる人間風景,"津名, 道代, 1933-",['260p ; 21cm'],2005,['図書']
国民皆介護 : 障害者自立支援法の成立,"京極, 高宣, 1942-",['181p ; 21cm'],2005,['図書']
忘れられた歴史はくり返す : 障害のある人が戦場に行った時代,"秋元, 波留夫, 1906-2007",['86p ; 21cm'],2006,['図書']
戦前戦後障害者運動史年表 : 戦前戦後障害者運動と関係法制,"杉本, 章, 1938-",['120p ; 26cm'],2001,['図書']
障害走,,['ビデオディスク 1枚 : DVD'],,"['映像資料', 'DVD']"
障害児教育学原論考 : 私家版,"藤井, 力夫, 1946-",['1004p ; 31cm'],2004,['図書']
知的障害養護学校における音楽科教育成立史研究,"藤原, 志帆",['1冊'],2005,['博士論文']
視覚障害教育の歴史・現状・課題 職業教育・進路保障と地域支援の充実を願って,"久松, 寅幸, 1951-",['CD-ROM 1枚 ; 12cm'],,"['電子資料', 'DVD・CD']"
岩手県障害児教育史資料,"中山, 文雄, 1937-",['112p ; 26cm'],2001,['図書']
近世障害者生活史の研究,"原田, 信一",['1冊'],2001,['博士論文']
清掃作業者のダイオキシン曝露による発癌リスク及び生殖障害に係る歴史的コホート研究,"毛利, 一平",['132p'],"2002, 2005",['図書']
リーディングス日本の社会福祉,"岩田, 正美, 1947-",['434p ; 22cm'],2011,['図書']
障害者社会史研究の地平を拓く : 故加藤康昭先生の生涯と業績,,['92p ; 30cm'],2004,['図書']
盲・聾分離をめざした苦闘・90年 : 第84回全日本盲学校教育研究大会研究発表 : 視覚障害教育の今後を考えるための史資料集,"岸, 博実, 1949-",['68p ; 30cm'],2009,"['図書', '政府刊行物', '地方公共団体刊行物']"
歴史と文化に見る身体障害者,"松尾, 智, 1957-",['210p ; 20cm'],2000,['図書']
障害者問題史研究紀要,精神薄弱問題史研究会,['冊 ; 26cm'],"1988, 2005",['雑誌']
特別支援教育の研究 : 重症心身障害児施設砂子療育園における医学・療育及び教育実践,"下川, 仁夫, 1951-",['349p ; 22cm'],2009,['図書']
日本知的障害教育学史の研究-明治期の近代化と欧米知的障害理論の受容・定着-,"高橋, 智, 1954-",['冊'],"2000, 2001",['図書']
発達障害児教育実践史研究 : 戦前の北海道における特別教育の成立と教育理念・目標・内容・方法,"市澤, 豊",['397p ; 22cm'],2006,['図書']
茨城県障害児教育史の研究,"船橋, 秀彦, 1955-",['223p ; 21cm'],1997,['図書']
地域で生きる : 自立をめざす重度障害者の自分史から,AJU自立の家,['209p ; 21cm'],2001,['図書']
日本の障害者雇用 : その歴史・現状・課題,"手塚, 直樹, 1933-",['338p ; 22cm'],2000,['図書']
言語障害児教育のあすを考える : 言語障害・難聴通級指導教室のルーツをさぐり、日本言語障害児教育研究会の歩みをたどる史料,"大熊, 喜代松, 1926-",['220p ; 26cm'],1997,['図書']
城戸幡太郎と日本の障害者教育科学 : 障害児教育における「近代化」と「現代化」の歴史的位相,"高橋, 智, 1954-","['694, 8p ; 22cm']",1998,['図書']
視覚障害者のための医学典籍講読法の開発と鍼灸・手技療法の歴史的考察,"和久田, 哲司",['60p'],"2001, 2003",['図書']
日本の障害者 : その文化史的側面,"花田, 春兆, 1925-2017",['258p ; 21cm'],1997,['図書']
日本の障害者の歴史 : 近世篇,"生瀬, 克己, 1942-2008",['269p ; 22cm'],1999,['図書']
近世障害者関係史料集成,"生瀬, 克己, 1942-2008",['806p ; 22cm'],1996,['図書']
城戸幡太郎の教育科学と障害児教育理論の研究 : 障害児教育における「近代化」と「現代化」の歴史的位相,"高橋, 智, 1954-",,,['博士論文']
語り継ぐトランスジェンダー史 : 性同一性障害の現在・過去・未来,"虎井, まさ衛, 1963-",['221p ; 19cm'],2003,['図書']
アメリカ合衆国障害児学校史の研究,"中村, 満紀男",['カセット 32巻'],1998,"['録音資料', 'カセットテープ']"
東京の知的障害児教育概説 : 戦後創設期編,"富岡, 達夫, 1928-",['382p ; 22cm'],2001,['図書']
ロシア障害児教育史の研究,"渡辺, 健治, 1948-",['375p ; 22cm'],1996,['図書']
歴史の中の障害者 : 盲人のあゆみ,,['16p ; 30cm'],1996,"['図書', '政府刊行物', '地方公共団体刊行物']"
京都障害者歴史散歩,"藤本, 文朗, 1935-",['181p ; 19cm'],1994,['図書']
教育実践でつづる知的障害教育方法史 : 教育方法の展開と探究,全日本特別支援教育研究連盟,['266p ; 21cm'],2002,['図書']
紙の機関車 : 日聴紙物語 : ろう者の人権を守り、連帯を深めてきた日本聴力障害新聞。その波瀾に満ちた歴史を今、ふり返る。,日本聴力障害新聞編集部,['55p ; 26cm'],2003,['図書']
特別な困難をもつ子どもたちと教育の社会化,,['216p ; 21cm'],2006,['図書']
前立腺肥大症の自然史と排尿障害の関係,"北川, 憲一",,,['博士論文']
摂食障害の臨床精神医学的研究 : 生活史上の家族内外傷体験に焦点づけた精神療法的関与,"駒井, 秀次",,,['博士論文']
アメリカ公教育制度における障害児の教育保障に関する歴史的研究,"安藤, 房治",['冊'],,['博士論文']
社会福祉法人京都身体障害者福祉センター30年史 : 輝く未来へ向かって,京都身体障害者福祉センター,['246p ; 26cm'],2000,['図書']
カドミウム環境汚染による健康障害の自然史に関する臨床疫学的研究,"加須屋, 實",['冊'],"1997, 1999",['図書']
放射性物質の人体摂取障害の記録 : 過ちの歴史に何を学ぶか,"松岡, 理, 1929-",['135p ; 21cm'],1995,['図書']
イギリス障害児「義務教育」制度成立史研究,"山口, 洋史, 1940-",['474p ; 22cm'],1993,['図書']
知られざる声 : 障害者の歴史に光を灯した女性たち,"Smith, J. David, 1944-",['255p ; 21cm'],1995,['図書']
身体障害者・高齢者と自動車運転 : その歴史的経緯と現状,国立身体障害者リハビリテーションセンター,['358p ; 26cm'],1994,"['図書', '政府刊行物', '官公庁刊行物']"
全障研三十年史 : 障害者の権利を守り、発達を保障するために,全国障害者問題研究会,['813p ; 22cm'],1997,['図書']
日本盲人史考 : 視力障害者の歴史と伝承 金属と片眼神,"森, 納, 1928-","['629, 21p ; 22cm']",1993,['図書']
スウェーデンの障害児教育改革 : 特別指導の歴史と現状,"Ahlström, Karl-Georg",['267p ; 22cm'],1995,['図書']
視覚障害者(児)の教育・職業・福祉 : その歴史と現状,日本盲人福祉研究会,['156p ; 26cm'],1989,['図書']
ドイツ障害児教育史研究 : 補助学校教育の確立と変容,"荒川, 智, 1957-","['346, 9p ; 22cm']",1990,['図書']
玉野裁判上告趣意書 : 玉野さん無罪は歴史の必然 言語障害者の参政権保障を求めて,玉野ふいさんを守る会,['209p ; 26cm'],1992,['図書']
アメリカ合衆国障害児学校史の研究,"中村, 満紀男, 1945-",['709p ; 22cm'],1987,['図書']
ドキュメント戦後の日本 : 新聞ニュースに見る社会史大事典,国立国会図書館,"['346, 73p ; 31cm']",1995,"['図書', '政府刊行物', '官公庁刊行物']"
障害者教育福祉リハビリテーション目次総覧,"津曲, 裕次, 1936-",['1冊 (頁付なし) ; 22cm'],1991,['図書']
障害者問題史文献目録,,['p81～100 ; 26cm'],1984,['図書']
玉野事件最終意見陳述書 : 玉野さん無罪は歴史の必然 言語障害者の参政権保障を求めて,玉野ふいさんを守る会,['110p ; 26cm'],1991,['図書']
広島の障害者福祉 : 障害者問題史とその実態,"田代, 国次郎, 1935-2014",['81p ; 26cm'],1982,['図書']
19世紀アメリカ障害児学校史の研究,"中村, 満紀男",,,['博士論文']
新たな福祉社会の創生を目指して : 現場・理論・歴史的視座からの発信,"溝口, 元, 1953-",['450p ; 22cm'],2024,['図書']
障害児学への道 : 柳川光章教授退官記念論文集,"柳川, 光章, 1923-",['207p ; 27cm'],1988,['図書']
幼児教育史研究の新地平.,幼児教育史学会,['389p ; 22cm'],2022,['図書']
戦後社会福祉の歴史研究と方法 : 継承・展開・創造 : 社会事業史学会創立50周年記念論文集.,社会事業史学会,"['16, 703 p ; 22 cm']",2022,['図書']
障害児保育論 : その理論と方法 待井和江先生古稀記念論文集,"待井, 和江, 1918-2011",['288p ; 22cm'],1988,['図書']
日本障害児教育学説史研究-1930年代の教育・保育科学理論の検討を中心に,"高橋, 智",['冊'],1988,['図書']
社会運動史研究.,"大野, 光明, 1979-",['237p ; 21cm'],2021,['図書']
発達保障思想の形成 : 障害児教育の史的探究,"清水, 寛, 1936-",['328p ; 20cm'],1981,['図書']
逆光の中の障害者たち : 古代史から現代文学まで,"後藤, 安彦, 1929-2008",['270p ; 19cm'],1982,['図書']
関西・大阪の社会経済問題の歴史と現状,関西大学経済史研究会,['233p ; 21cm'],2020,['図書']
アメリカ初期知能障害児学校史の研究,"津曲, 裕次",['冊'],,['博士論文']
障害者教育の歴史的成立 : ルソー・イタール・セガン・モンテッソーリ,"津田, 道夫, 1929-2014",['178p ; 20cm'],1982,['図書']
羅針盤としての政策史 : 歴史研究からヘルスケア・福祉政策の展望を拓く,"猪飼, 周平",['280p ; 22cm'],2019,['図書']
歴史を未来につなぐ : 「3・11からの歴史学」の射程,歴史学研究会,"['332,2p ; 21cm']",2019,['図書']
ジャーナリズムは歴史の第一稿である。,"瀬川, 至朗, 1954-","['303, 15p ; 19cm']",2018,['図書']
日本聾史研究,日本聾史研究会,['63p ; 26cm'],2018,['図書']
小脳性言語障害の臨床 : その歴史的背景と新しい局在論,"坂井, 春男",['冊'],,['博士論文']
出生前診断受ける受けない誰が決めるの? : 遺伝相談の歴史に学ぶ,"山中, 美智子, 1958-",['242p ; 21cm'],2017,['図書']
犯罪学と精神医学史研究,"影山, 任佐, 1948-",['332p ; 22cm'],2017,['図書']
障害児教育学研究 : 荒川勇教授退官記念論文集,"荒川, 勇, 1918-2005",['331p ; 26cm'],1982,['図書']
日本における心身障害者体育の史的研究,,['22p ; 26cm'],1983,['図書']
むつぼしのひかり.,点字雑誌むつぼしのひかりデータ化研究プロジェクト,['CD-ROM ; 12 cm'],2016,"['雑誌', 'DVD・CD', '電子資料']"
知っておきたい歴史の新常識,歴史科学協議会,['215p ; 21cm'],2017,['図書']
日本における心身障害者体育の史的研究,,['25p ; 26cm'],1984,['図書']
戦後障害児教育史資料,戦後障害児教育史研究会,['40p ; 25cm'],1978,['図書']
人間発達研究の創出と展開 : 田中昌人・田中杉恵の仕事をとおして歴史をつなぐ,"中村, 隆一, 1954-",['275p ; 21cm'],2016,['図書']
刑事法と歴史的価値とその交錯 : 内田博文先生古稀祝賀論文集,"徳田, 靖之, 1944-",['976p ; 22cm'],2016,['図書']
精神疾患者の自分史 : 児童虐待の後遺症・新興宗教二世・アスペルガー,"田上, 光, 1971-",['211 p ; 18 cm'],2022,['図書']
大都市・東京の社会教育 : 歴史と現在,,['573p ; 22cm'],2016,['図書']
日本史学のフロンティア,"荒武, 賢一朗",['310p ; 22cm'],2015,['図書']
精神保健福祉法の最新知識 : 歴史と臨床実務,日本精神科病院協会,['530p ; 21cm'],2015,['図書']
特別支援教育・福祉年史集成,"津曲, 裕次, 1936-",['1冊 ; 27cm'],2015,['図書']
福祉・人権概念の転回と歴史認識の転換 : プロジェクト共同研究,大阪産業大学産業研究所,['130p ; 21cm'],2015,['図書']
犯罪学と精神医学史研究,"影山, 任佐, 1948-",['310p ; 22cm'],2015,['図書']
国語語彙史の研究,国語語彙史研究会,['399p ; 22cm'],2015,['図書']
規制の事前評価書,,,,
歴史をつくった市民たち : 語り下ろし市民活動,大阪ボランティア協会,['247p ; 21cm'],2014,['図書']
民事法学の歴史と未来 : 田山輝明先生古稀記念論文集,"五十嵐, 敬喜, 1944-",['708p ; 22cm'],2014,['図書']
常設展示,,,,
特別支援・特別ニーズ教育の源流 : 鈴木治太郎の教育改革と適能教育論,"高橋, 智, 1954-",['407p ; 22cm'],2010,['図書']
